{
  "schemaVersion": "lgfc-cumulative-evidence:v1",
  "idempotencyKey": "sandbox-exit-2678-demo-001",
  "sourceIssue": 2882,
  "workUnitId": "2678-001",
  "lane": "sandbox",
  "transition": "exit",
  "candidateSha": null,
  "actorRole": "implementation_operations",
  "actor": "Cursor Local",
  "timestamp": "2026-07-31T14:00:00.000Z",
  "result": "pass",
  "evidenceRefs": [
    {
      "kind": "document",
      "uri": "docs/reference/operations/cumulative-lane-evidence-contract.md"
    }
  ],
  "supersedes": null,
  "protectedStops": [],
  "nextExpectedTransition": "enter",
  "summary": "Sandbox experiment adopted into Development package.",
  "laneFields": {
    "hypothesis": "Append-only evidence events can encode Sandbox exit without Production path.",
    "isolationBoundary": "component/cumulative-lane-evidence only; no main mutation",
    "observedResult": "Schema and fixtures validate; no workflow change.",
    "disposition": "adopt_to_development",
    "carriedRisks": []
  }
}
