{
  "schemaVersion": "lgfc-cumulative-evidence:v1",
  "idempotencyKey": "promotion-exit-2678-demo-001",
  "sourceIssue": 2882,
  "workUnitId": "2678-001",
  "lane": "promotion_candidate",
  "transition": "exit",
  "candidateSha": "aaaaaaaaaaaaaaaaaaaaaaaaaaaaaaaaaaaaaaaa",
  "actorRole": "pmo_engineering",
  "actor": "Claude Code",
  "timestamp": "2026-07-31T16:00:00.000Z",
  "result": "pass",
  "evidenceRefs": [
    { "kind": "commit", "uri": "aaaaaaaaaaaaaaaaaaaaaaaaaaaaaaaaaaaaaaaa" }
  ],
  "supersedes": null,
  "protectedStops": [],
  "nextExpectedTransition": "enter",
  "summary": "Promotion Candidate qualified with Production Go recommendation.",
  "laneFields": {
    "candidateSha": "aaaaaaaaaaaaaaaaaaaaaaaaaaaaaaaaaaaaaaaa",
    "qualificationEvidence": {
      "regression": "PASS",
      "security": "PASS",
      "rollback": "documented"
    },
    "driftReconciliation": "No unreviewed drift from integrated Development candidate.",
    "unresolvedRisks": [],
    "productionRecommendation": "go"
  }
}
